{"$schema":"https://json-schema.org/draft/2020-12/schema","title":"BackendCapabilities v1","type":"object","additionalProperties":false,"required":["formatVersion","backend","adapter","integrationTier","capabilities","authenticationRouteClasses","adapterPermissions"],"properties":{"formatVersion":{"const":"stateport.backend-capabilities/v1"},"backend":{"type":"object","additionalProperties":false,"required":["id"],"properties":{"id":{"type":"string","minLength":1}}},"adapter":{"type":"object","additionalProperties":false,"required":["id","version","testOnly","productionEligible"],"properties":{"id":{"type":"string","minLength":1},"version":{"type":"string","minLength":1},"testOnly":{"type":"boolean"},"productionEligible":{"type":"boolean"}}},"integrationTier":{"enum":["portable","managed","reference","api_native"]},"capabilities":{"type":"object","additionalProperties":false,"required":["structuredEvents","nonInteractiveExecution","cancellation","sessionResume","repositoryInstructions","customTools","mcpEquivalent","approvalIntegration","sandboxSupport","changedFileReporting","tokenTelemetry","costTelemetry"],"properties":{"structuredEvents":{"enum":["native","emulated","supported","partial","unsupported","unavailable","environment-gated","unknown"]},"nonInteractiveExecution":{"enum":["native","emulated","supported","partial","unsupported","unavailable","environment-gated","unknown"]},"cancellation":{"enum":["native","emulated","supported","partial","unsupported","unavailable","environment-gated","unknown"]},"sessionResume":{"enum":["native","emulated","supported","partial","unsupported","unavailable","environment-gated","unknown"]},"repositoryInstructions":{"enum":["native","emulated","supported","partial","unsupported","unavailable","environment-gated","unknown"]},"customTools":{"enum":["native","emulated","supported","partial","unsupported","unavailable","environment-gated","unknown"]},"mcpEquivalent":{"enum":["native","emulated","supported","partial","unsupported","unavailable","environment-gated","unknown"]},"approvalIntegration":{"enum":["native","emulated","supported","partial","unsupported","unavailable","environment-gated","unknown"]},"sandboxSupport":{"enum":["native","emulated","supported","partial","unsupported","unavailable","environment-gated","unknown"]},"changedFileReporting":{"enum":["native","emulated","supported","partial","unsupported","unavailable","environment-gated","unknown"]},"tokenTelemetry":{"enum":["native","emulated","supported","partial","unsupported","unavailable","environment-gated","unknown"]},"costTelemetry":{"enum":["native","emulated","supported","partial","unsupported","unavailable","environment-gated","unknown"]}}},"authenticationRouteClasses":{"type":"array","items":{"type":"string","minLength":1}},"adapterPermissions":{"type":"array","items":{"type":"string","minLength":1}}}}
